.miopen_cache/gfx1201_28.HIP.3_5_1_bd74c59a5c.ufdb.txt
80-1-3000-1x3-768-1-3000-1-0x1-1x1-1x1-0-NCHW-FP16-F=ConvDirectNaiveConvFwd:7.07325,0,miopenConvolutionFwdAlgoDirect;GemmFwdRest:0.144733,1440000,miopenConvolutionFwdAlgoGEMM;ConvWinoFuryRxS<2-3>:0.14116,0,miopenConvolutionFwdAlgoWinograd
80-1-3000-1x3-1024-1-3000-8-0x1-1x1-1x1-0-NCHW-FP16-F=ConvDirectNaiveConvFwd:66.6691,0,miopenConvolutionFwdAlgoDirect;GemmFwdRest:1.11044,1440000,miopenConvolutionFwdAlgoGEMM
1024-1-3000-1x3-1024-1-1500-8-0x1-1x2-1x1-0-NCHW-FP16-F=ConvDirectNaiveConvFwd:430.29,0,miopenConvolutionFwdAlgoDirect;GemmFwdRest:3.57953,9216000,miopenConvolutionFwdAlgoGEMM
80-1-3000-1x3-1024-1-3000-6-0x1-1x1-1x1-0-NCHW-FP16-F=ConvDirectNaiveConvFwd:53.0262,0,miopenConvolutionFwdAlgoDirect;GemmFwdRest:0.845111,1440000,miopenConvolutionFwdAlgoGEMM
1024-1-3000-1x3-1024-1-1500-6-0x1-1x2-1x1-0-NCHW-FP16-F=ConvDirectNaiveConvFwd:317.42,0,miopenConvolutionFwdAlgoDirect;GemmFwdRest:2.67115,9216000,miopenConvolutionFwdAlgoGEMM
80-1-3000-1x3-1024-1-3000-7-0x1-1x1-1x1-0-NCHW-FP16-F=ConvDirectNaiveConvFwd:60.0484,0,miopenConvolutionFwdAlgoDirect;GemmFwdRest:0.97342,1440000,miopenConvolutionFwdAlgoGEMM
1024-1-3000-1x3-1024-1-1500-7-0x1-1x2-1x1-0-NCHW-FP16-F=ConvDirectNaiveConvFwd:369.233,0,miopenConvolutionFwdAlgoDirect;GemmFwdRest:3.13371,9216000,miopenConvolutionFwdAlgoGEMM
80-1-3000-1x3-1024-1-3000-4-0x1-1x1-1x1-0-NCHW-FP16-F=ConvDirectNaiveConvFwd:34.6619,0,miopenConvolutionFwdAlgoDirect;GemmFwdRest:0.54862,1440000,miopenConvolutionFwdAlgoGEMM
1024-1-3000-1x3-1024-1-1500-4-0x1-1x2-1x1-0-NCHW-FP16-F=ConvDirectNaiveConvFwd:215.639,0,miopenConvolutionFwdAlgoDirect;GemmFwdRest:1.80222,9216000,miopenConvolutionFwdAlgoGEMM
80-1-3000-1x3-1024-1-3000-5-0x1-1x1-1x1-0-NCHW-FP16-F=ConvDirectNaiveConvFwd:42.6258,0,miopenConvolutionFwdAlgoDirect;GemmFwdRest:0.682143,1440000,miopenConvolutionFwdAlgoGEMM
1024-1-3000-1x3-1024-1-1500-5-0x1-1x2-1x1-0-NCHW-FP16-F=ConvDirectNaiveConvFwd:272.343,0,miopenConvolutionFwdAlgoDirect;GemmFwdRest:2.18477,9216000,miopenConvolutionFwdAlgoGEMM
80-1-3000-1x3-1024-1-3000-3-0x1-1x1-1x1-0-NCHW-FP16-F=ConvDirectNaiveConvFwd:26.0246,0,miopenConvolutionFwdAlgoDirect;GemmFwdRest:0.483686,1440000,miopenConvolutionFwdAlgoGEMM
1024-1-3000-1x3-1024-1-1500-3-0x1-1x2-1x1-0-NCHW-FP16-F=ConvDirectNaiveConvFwd:162.831,0,miopenConvolutionFwdAlgoDirect;GemmFwdRest:1.37601,9216000,miopenConvolutionFwdAlgoGEMM
80-1-3000-1x3-1024-1-3000-2-0x1-1x1-1x1-0-NCHW-FP16-F=ConvDirectNaiveConvFwd:17.6192,0,miopenConvolutionFwdAlgoDirect;GemmFwdRest:0.279914,1440000,miopenConvolutionFwdAlgoGEMM
1024-1-3000-1x3-1024-1-1500-2-0x1-1x2-1x1-0-NCHW-FP16-F=ConvDirectNaiveConvFwd:110.765,0,miopenConvolutionFwdAlgoDirect;GemmFwdRest:0.84183,9216000,miopenConvolutionFwdAlgoGEMM
2-1-4096-1x1-64-1-4096-1-0x0-1x1-1x1-0-NCHW-FP32-F=ConvDirectNaiveConvFwd:0.07906,0,miopenConvolutionFwdAlgoDirect;GemmFwd1x1_0_1:0.0361,0,miopenConvolutionFwdAlgoGEMM
32-1-4096-1x3-32-1-4096-1-0x1-1x1-1x1-0-NCHW-FP32-F_g32=ConvDirectNaiveConvFwd:0.0432,0,miopenConvolutionFwdAlgoDirect;GemmFwdRest:0.129337,1572864,miopenConvolutionFwdAlgoGEMM
32-1-4096-1x1-64-1-4096-1-0x0-1x1-1x1-0-NCHW-FP32-F=ConvDirectNaiveConvFwd:0.628733,0,miopenConvolutionFwdAlgoDirect;GemmFwd1x1_0_1:0.041825,0,miopenConvolutionFwdAlgoGEMM
32-1-4096-1x1-32-1-4096-1-0x0-1x1-1x1-0-NCHW-FP32-F=ConvDirectNaiveConvFwd:0.47495,0,miopenConvolutionFwdAlgoDirect;GemmFwd1x1_0_1:0.029,0,miopenConvolutionFwdAlgoGEMM
2-1-513-1x3-2-1-513-1-0x1-1x1-1x1-0-NCHW-FP32-F_g2=ConvDirectNaiveConvFwd:0.05684,0,miopenConvolutionFwdAlgoDirect;GemmFwdRest:0.0564857,12312,miopenConvolutionFwdAlgoGEMM
2-1-513-1x1-64-1-513-1-0x0-1x1-1x1-0-NCHW-FP32-F=ConvDirectNaiveConvFwd:0.05756,0,miopenConvolutionFwdAlgoDirect;GemmFwd1x1_0_1:0.00048,0,miopenConvolutionFwdAlgoGEMM
64-1-513-1x1-64-1-513-1-0x0-1x1-1x1-0-NCHW-FP32-F=ConvDirectNaiveConvFwd:0.14652,0,miopenConvolutionFwdAlgoDirect;GemmFwd1x1_0_1:0.00216667,0,miopenConvolutionFwdAlgoGEMM
64-513-17-1x1-64-513-17-1-0x0-1x1-1x1-0-NCHW-FP32-F=ConvDirectNaiveConvFwd:0.954325,0,miopenConvolutionFwdAlgoDirect;GemmFwd1x1_0_1:0.0398114,0,miopenConvolutionFwdAlgoGEMM
64-1-4096-1x1-128-1-4096-1-0x0-1x1-1x1-0-NCHW-FP32-F=ConvDirectNaiveConvFwd:0.811543,0,miopenConvolutionFwdAlgoDirect;GemmFwd1x1_0_1:0.02978,0,miopenConvolutionFwdAlgoGEMM
64-1-4096-1x1-64-1-4096-1-0x0-1x1-1x1-0-NCHW-FP32-F=ConvDirectNaiveConvFwd:0.5026,0,miopenConvolutionFwdAlgoDirect;GemmFwd1x1_0_1:0.0173,0,miopenConvolutionFwdAlgoGEMM
64-1-4096-1x1-1-1-4096-1-0x0-1x1-1x1-0-NCHW-FP32-F=ConvDirectNaiveConvFwd:0.851857,0,miopenConvolutionFwdAlgoDirect;GemmFwd1x1_0_1:0.01858,0,miopenConvolutionFwdAlgoGEMM
7-12-16-3x3-96-6-8-1-1x1-2x2-1x1-0-NCHW-FP16-F=ConvDirectNaiveConvFwd:0.05754,0,miopenConvolutionFwdAlgoDirect;GemmFwdRest:0.12407,6048,miopenConvolutionFwdAlgoGEMM
96-6-8-3x3-192-3-4-1-1x1-2x2-1x1-0-NCHW-FP16-F=ConvDirectNaiveConvFwd:0.41815,0,miopenConvolutionFwdAlgoDirect;GemmFwdRest:0.10318,20736,miopenConvolutionFwdAlgoGEMM
192-3-4-3x3-192-3-4-1-1x1-1x1-1x1-0-NCHW-FP16-F=ConvDirectNaiveConvFwd:0.748157,0,miopenConvolutionFwdAlgoDirect;GemmFwdRest:0.112615,41472,miopenConvolutionFwdAlgoGEMM;ConvWinoFuryRxS<2-3>:0.0698398,0,miopenConvolutionFwdAlgoWinograd
192-3-4-4x4-24-6-8-1-1x1-2x2-1x1-0-NCHW-FP16-B=ConvDirectNaiveConvBwd:0.871283,0,miopenConvolutionBwdDataAlgoDirect;GemmBwdRest:0.0447675,9216,miopenConvolutionBwdDataAlgoGEMM
12-24-32-3x3-64-12-16-1-1x1-2x2-1x1-0-NCHW-FP16-F=ConvDirectNaiveConvFwd:0.0946833,0,miopenConvolutionFwdAlgoDirect;GemmFwdRest:0.0583844,41472,miopenConvolutionFwdAlgoGEMM
64-12-16-3x3-128-6-8-1-1x1-2x2-1x1-0-NCHW-FP16-F=ConvDirectNaiveConvFwd:0.24506,0,miopenConvolutionFwdAlgoDirect;GemmFwdRest:0.060824,55296,miopenConvolutionFwdAlgoGEMM
128-6-8-3x3-128-6-8-1-1x1-1x1-1x1-0-NCHW-FP16-F=ConvDirectNaiveConvFwd:0.4256,0,miopenConvolutionFwdAlgoDirect;GemmFwdRest:0.0596416,110592,miopenConvolutionFwdAlgoGEMM;ConvWinoFuryRxS<2-3>:0.04945,0,miopenConvolutionFwdAlgoWinograd
128-6-8-4x4-24-12-16-1-1x1-2x2-1x1-0-NCHW-FP16-B=ConvDirectNaiveConvBwd:0.6625,0,miopenConvolutionBwdDataAlgoDirect;GemmBwdRest:0.06694,36864,miopenConvolutionBwdDataAlgoGEMM
12-48-64-3x3-48-24-32-1-1x1-2x2-1x1-0-NCHW-FP16-F=ConvDirectNaiveConvFwd:0.1284,0,miopenConvolutionFwdAlgoDirect;GemmFwdRest:0.0760503,165888,miopenConvolutionFwdAlgoGEMM
48-24-32-3x3-96-12-16-1-1x1-2x2-1x1-0-NCHW-FP16-F=ConvDirectNaiveConvFwd:0.26022,0,miopenConvolutionFwdAlgoDirect;GemmFwdRest:0.0618702,165888,miopenConvolutionFwdAlgoGEMM
96-12-16-3x3-96-12-16-1-1x1-1x1-1x1-0-NCHW-FP16-F=ConvDirectNaiveConvFwd:0.44814,0,miopenConvolutionFwdAlgoDirect;GemmFwdRest:0.0682753,331776,miopenConvolutionFwdAlgoGEMM;ConvWinoFuryRxS<2-3>:0.0628798,0,miopenConvolutionFwdAlgoWinograd
96-12-16-4x4-24-24-32-1-1x1-2x2-1x1-0-NCHW-FP16-B=ConvDirectNaiveConvBwd:1.1551,0,miopenConvolutionBwdDataAlgoDirect;GemmBwdRest:0.0584556,147456,miopenConvolutionBwdDataAlgoGEMM
12-96-128-3x3-32-48-64-1-1x1-2x2-1x1-0-NCHW-FP16-F=ConvDirectNaiveConvFwd:0.3633,0,miopenConvolutionFwdAlgoDirect;GemmFwdRest:0.0663714,663552,miopenConvolutionFwdAlgoGEMM
32-48-64-3x3-64-24-32-1-1x1-2x2-1x1-0-NCHW-FP16-F=ConvDirectNaiveConvFwd:0.339733,0,miopenConvolutionFwdAlgoDirect;GemmFwdRest:0.0398097,442368,miopenConvolutionFwdAlgoGEMM
64-24-32-3x3-64-24-32-1-1x1-1x1-1x1-0-NCHW-FP16-F=ConvDirectNaiveConvFwd:0.671333,0,miopenConvolutionFwdAlgoDirect;GemmFwdRest:0.0539432,884736,miopenConvolutionFwdAlgoGEMM;ConvWinoFuryRxS<2-3>:0.0577498,0,miopenConvolutionFwdAlgoWinograd
64-24-32-4x4-24-48-64-1-1x1-2x2-1x1-0-NCHW-FP16-B=ConvDirectNaiveConvBwd:2.73678,0,miopenConvolutionBwdDataAlgoDirect;GemmBwdRest:0.0422222,589824,miopenConvolutionBwdDataAlgoGEMM
7-32-56-3x3-96-16-28-1-1x1-2x2-1x1-0-NCHW-FP16-F=ConvDirectNaiveConvFwd:0.111571,0,miopenConvolutionFwdAlgoDirect;GemmFwdRest:0.0383433,56448,miopenConvolutionFwdAlgoGEMM
96-16-28-3x3-192-8-14-1-1x1-2x2-1x1-0-NCHW-FP16-F=ConvDirectNaiveConvFwd:0.403933,0,miopenConvolutionFwdAlgoDirect;GemmFwdRest:0.06298,193536,miopenConvolutionFwdAlgoGEMM
192-8-14-3x3-192-8-14-1-1x1-1x1-1x1-0-NCHW-FP16-F=ConvDirectNaiveConvFwd:0.705517,0,miopenConvolutionFwdAlgoDirect;GemmFwdRest:0.0449714,387072,miopenConvolutionFwdAlgoGEMM;ConvWinoFuryRxS<2-3>:0.0493714,0,miopenConvolutionFwdAlgoWinograd
192-8-14-4x4-24-16-28-1-1x1-2x2-1x1-0-NCHW-FP16-B=ConvDirectNaiveConvBwd:1.79354,0,miopenConvolutionBwdDataAlgoDirect;GemmBwdRest:0.04042,86016,miopenConvolutionBwdDataAlgoGEMM
12-64-112-3x3-64-32-56-1-1x1-2x2-1x1-0-NCHW-FP16-F=ConvDirectNaiveConvFwd:0.335429,0,miopenConvolutionFwdAlgoDirect;GemmFwdRest:0.04364,387072,miopenConvolutionFwdAlgoGEMM
64-32-56-3x3-128-16-28-1-1x1-2x2-1x1-0-NCHW-FP16-F=ConvDirectNaiveConvFwd:0.67906,0,miopenConvolutionFwdAlgoDirect;GemmFwdRest:0.0626857,516096,miopenConvolutionFwdAlgoGEMM
128-16-28-3x3-128-16-28-1-1x1-1x1-1x1-0-NCHW-FP16-F=ConvDirectNaiveConvFwd:1.257,0,miopenConvolutionFwdAlgoDirect;GemmFwdRest:0.09565,1032192,miopenConvolutionFwdAlgoGEMM;ConvWinoFuryRxS<2-3>:0.0745833,0,miopenConvolutionFwdAlgoWinograd
128-16-28-4x4-24-32-56-1-1x1-2x2-1x1-0-NCHW-FP16-B=ConvDirectNaiveConvBwd:3.71443,0,miopenConvolutionBwdDataAlgoDirect;GemmBwdRest:0.0421283,344064,miopenConvolutionBwdDataAlgoGEMM
12-128-224-3x3-48-64-112-1-1x1-2x2-1x1-0-NCHW-FP16-F=ConvDirectNaiveConvFwd:0.81798,0,miopenConvolutionFwdAlgoDirect;GemmFwdRest:0.173016,1548288,miopenConvolutionFwdAlgoGEMM
48-64-112-3x3-96-32-56-1-1x1-2x2-1x1-0-NCHW-FP16-F=ConvDirectNaiveConvFwd:1.39826,0,miopenConvolutionFwdAlgoDirect;GemmFwdRest:0.104654,1548288,miopenConvolutionFwdAlgoGEMM
96-32-56-3x3-96-32-56-1-1x1-1x1-1x1-0-NCHW-FP16-F=ConvDirectNaiveConvFwd:2.6879,0,miopenConvolutionFwdAlgoDirect;GemmFwdRest:0.0789967,3096576,miopenConvolutionFwdAlgoGEMM;ConvWinoFuryRxS<2-3>:0.0648286,0,miopenConvolutionFwdAlgoWinograd
96-32-56-4x4-24-64-112-1-1x1-2x2-1x1-0-NCHW-FP16-B=ConvDirectNaiveConvBwd:9.38752,0,miopenConvolutionBwdDataAlgoDirect;GemmBwdRest:0.0923017,1376256,miopenConvolutionBwdDataAlgoGEMM
12-256-448-3x3-32-128-224-1-1x1-2x2-1x1-0-NCHW-FP16-F=ConvDirectNaiveConvFwd:3.13013,0,miopenConvolutionFwdAlgoDirect;GemmFwdRest:0.150623,6193152,miopenConvolutionFwdAlgoGEMM
32-128-224-3x3-64-64-112-1-1x1-2x2-1x1-0-NCHW-FP16-F=ConvDirectNaiveConvFwd:2.87171,0,miopenConvolutionFwdAlgoDirect;GemmFwdRest:0.161403,4128768,miopenConvolutionFwdAlgoGEMM
64-64-112-3x3-64-64-112-1-1x1-1x1-1x1-0-NCHW-FP16-F=ConvDirectNaiveConvFwd:5.31237,0,miopenConvolutionFwdAlgoDirect;GemmFwdRest:0.083056,8257536,miopenConvolutionFwdAlgoGEMM;ConvWinoFuryRxS<2-3>:0.0480429,0,miopenConvolutionFwdAlgoWinograd
64-64-112-4x4-24-128-224-1-1x1-2x2-1x1-0-NCHW-FP16-B=ConvDirectNaiveConvBwd:23.2435,0,miopenConvolutionBwdDataAlgoDirect;GemmBwdRest:0.127797,5505024,miopenConvolutionBwdDataAlgoGEMM
7-136-240-3x3-96-68-120-1-1x1-2x2-1x1-0-NCHW-FP16-F=ConvDirectNaiveConvFwd:0.966867,0,miopenConvolutionFwdAlgoDirect;GemmFwdRest:0.0989817,1028160,miopenConvolutionFwdAlgoGEMM
96-68-120-3x3-192-34-60-1-1x1-2x2-1x1-0-NCHW-FP16-F=ConvDirectNaiveConvFwd:5.36619,0,miopenConvolutionFwdAlgoDirect;GemmFwdRest:0.116587,3525120,miopenConvolutionFwdAlgoGEMM
192-34-60-3x3-192-34-60-1-1x1-1x1-1x1-0-NCHW-FP16-F=ConvDirectNaiveConvFwd:8.7826,0,miopenConvolutionFwdAlgoDirect;GemmFwdRest:0.0966325,7050240,miopenConvolutionFwdAlgoGEMM;ConvWinoFuryRxS<2-3>:0.0592167,0,miopenConvolutionFwdAlgoWinograd
192-34-60-4x4-24-68-120-1-1x1-2x2-1x1-0-NCHW-FP16-B=ConvDirectNaiveConvBwd:22.8579,0,miopenConvolutionBwdDataAlgoDirect;GemmBwdRest:0.08856,1566720,miopenConvolutionBwdDataAlgoGEMM
12-272-480-3x3-64-136-240-1-1x1-2x2-1x1-0-NCHW-FP16-F=ConvDirectNaiveConvFwd:4.52164,0,miopenConvolutionFwdAlgoDirect;GemmFwdRest:0.096726,7050240,miopenConvolutionFwdAlgoGEMM
64-136-240-3x3-128-68-120-1-1x1-2x2-1x1-0-NCHW-FP16-F=ConvDirectNaiveConvFwd:8.6416,0,miopenConvolutionFwdAlgoDirect;GemmFwdRest:0.130441,9400320,miopenConvolutionFwdAlgoGEMM
128-68-120-3x3-128-68-120-1-1x1-1x1-1x1-0-NCHW-FP16-F=ConvDirectNaiveConvFwd:17.1623,0,miopenConvolutionFwdAlgoDirect;GemmFwdRest:0.202837,18800640,miopenConvolutionFwdAlgoGEMM;ConvWinoFuryRxS<2-3>:0.0637833,0,miopenConvolutionFwdAlgoWinograd
128-68-120-4x4-24-136-240-1-1x1-2x2-1x1-0-NCHW-FP16-B=ConvDirectNaiveConvBwd:53.7202,0,miopenConvolutionBwdDataAlgoDirect;GemmBwdRest:0.09802,6266880,miopenConvolutionBwdDataAlgoGEMM
12-544-960-3x3-48-272-480-1-1x1-2x2-1x1-0-NCHW-FP16-F=ConvDirectNaiveConvFwd:12.3775,0,miopenConvolutionFwdAlgoDirect;GemmFwdRest:0.267314,28200960,miopenConvolutionFwdAlgoGEMM
48-272-480-3x3-96-136-240-1-1x1-2x2-1x1-0-NCHW-FP16-F=ConvDirectNaiveConvFwd:21.2006,0,miopenConvolutionFwdAlgoDirect;GemmFwdRest:0.179383,28200960,miopenConvolutionFwdAlgoGEMM
96-136-240-3x3-96-136-240-1-1x1-1x1-1x1-0-NCHW-FP16-F=ConvDirectNaiveConvFwd:42.186,0,miopenConvolutionFwdAlgoDirect;GemmFwdRest:0.26804,56401920,miopenConvolutionFwdAlgoGEMM;ConvWinoFuryRxS<2-3>:0.087675,0,miopenConvolutionFwdAlgoWinograd
96-136-240-4x4-24-272-480-1-1x1-2x2-1x1-0-NCHW-FP16-B=ConvDirectNaiveConvBwd:154.52,0,miopenConvolutionBwdDataAlgoDirect;GemmBwdRest:0.220968,25067520,miopenConvolutionBwdDataAlgoGEMM
12-1088-1920-3x3-32-544-960-1-1x1-2x2-1x1-0-NCHW-FP16-F=ConvDirectNaiveConvFwd:47.9708,0,miopenConvolutionFwdAlgoDirect;GemmFwdRest:0.840297,112803840,miopenConvolutionFwdAlgoGEMM
32-544-960-3x3-64-272-480-1-1x1-2x2-1x1-0-NCHW-FP16-F=ConvDirectNaiveConvFwd:43.2162,0,miopenConvolutionFwdAlgoDirect;GemmFwdRest:0.45079,75202560,miopenConvolutionFwdAlgoGEMM
64-272-480-3x3-64-272-480-1-1x1-1x1-1x1-0-NCHW-FP16-F=ConvDirectNaiveConvFwd:86.5548,0,miopenConvolutionFwdAlgoDirect;GemmFwdRest:0.713297,150405120,miopenConvolutionFwdAlgoGEMM;ConvWinoFuryRxS<2-3>:0.128257,0,miopenConvolutionFwdAlgoWinograd
64-272-480-4x4-24-544-960-1-1x1-2x2-1x1-0-NCHW-FP16-B=ConvDirectNaiveConvBwd:408.226,0,miopenConvolutionBwdDataAlgoDirect;GemmBwdRest:0.734369,100270080,miopenConvolutionBwdDataAlgoGEMM
7-136-240-3x3-96-68-120-1-1x1-2x2-1x1-0-NCHW-FP32-F=ConvDirectNaiveConvFwd:1.06284,0,miopenConvolutionFwdAlgoDirect;GemmFwdRest:0.149083,2056320,miopenConvolutionFwdAlgoGEMM
96-68-120-3x3-192-34-60-1-1x1-2x2-1x1-0-NCHW-FP32-F=ConvDirectNaiveConvFwd:5.07033,0,miopenConvolutionFwdAlgoDirect;GemmFwdRest:0.37684,7050240,miopenConvolutionFwdAlgoGEMM
192-34-60-3x3-192-34-60-1-1x1-1x1-1x1-0-NCHW-FP32-F=ConvDirectNaiveConvFwd:10.3611,0,miopenConvolutionFwdAlgoDirect;GemmFwdRest:0.66079,14100480,miopenConvolutionFwdAlgoGEMM
192-34-60-4x4-24-68-120-1-1x1-2x2-1x1-0-NCHW-FP32-B=ConvDirectNaiveConvBwd:42.9211,0,miopenConvolutionBwdDataAlgoDirect;GemmBwdRest:0.17418,3133440,miopenConvolutionBwdDataAlgoGEMM
12-272-480-3x3-64-136-240-1-1x1-2x2-1x1-0-NCHW-FP32-F=ConvDirectNaiveConvFwd:4.94872,0,miopenConvolutionFwdAlgoDirect;GemmFwdRest:0.391684,14100480,miopenConvolutionFwdAlgoGEMM
64-136-240-3x3-128-68-120-1-1x1-2x2-1x1-0-NCHW-FP32-F=ConvDirectNaiveConvFwd:11.4475,0,miopenConvolutionFwdAlgoDirect;GemmFwdRest:0.61388,18800640,miopenConvolutionFwdAlgoGEMM
128-68-120-3x3-128-68-120-1-1x1-1x1-1x1-0-NCHW-FP32-F=ConvDirectNaiveConvFwd:22.7648,0,miopenConvolutionFwdAlgoDirect;GemmFwdRest:1.21642,37601280,miopenConvolutionFwdAlgoGEMM
128-68-120-4x4-24-136-240-1-1x1-2x2-1x1-0-NCHW-FP32-B=ConvDirectNaiveConvBwd:80.6386,0,miopenConvolutionBwdDataAlgoDirect;GemmBwdRest:0.440014,12533760,miopenConvolutionBwdDataAlgoGEMM
12-544-960-3x3-48-272-480-1-1x1-2x2-1x1-0-NCHW-FP32-F=ConvDirectNaiveConvFwd:26.5142,0,miopenConvolutionFwdAlgoDirect;GemmFwdRest:1.05424,56401920,miopenConvolutionFwdAlgoGEMM
48-272-480-3x3-96-136-240-1-1x1-2x2-1x1-0-NCHW-FP32-F=ConvDirectNaiveConvFwd:33.0628,0,miopenConvolutionFwdAlgoDirect;GemmFwdRest:1.26688,56401920,miopenConvolutionFwdAlgoGEMM
96-136-240-3x3-96-136-240-1-1x1-1x1-1x1-0-NCHW-FP32-F=ConvDirectNaiveConvFwd:60.7639,0,miopenConvolutionFwdAlgoDirect;GemmFwdRest:2.53974,112803840,miopenConvolutionFwdAlgoGEMM
96-136-240-4x4-24-272-480-1-1x1-2x2-1x1-0-NCHW-FP32-B=ConvDirectNaiveConvBwd:245.543,0,miopenConvolutionBwdDataAlgoDirect;GemmBwdRest:1.09839,50135040,miopenConvolutionBwdDataAlgoGEMM
12-1088-1920-3x3-32-544-960-1-1x1-2x2-1x1-0-NCHW-FP32-F=ConvDirectNaiveConvFwd:76.5643,0,miopenConvolutionFwdAlgoDirect;GemmFwdRest:3.41505,225607680,miopenConvolutionFwdAlgoGEMM
32-544-960-3x3-64-272-480-1-1x1-2x2-1x1-0-NCHW-FP32-F=ConvDirectNaiveConvFwd:70.4852,0,miopenConvolutionFwdAlgoDirect;GemmFwdRest:3.65088,150405120,miopenConvolutionFwdAlgoGEMM
64-272-480-3x3-64-272-480-1-1x1-1x1-1x1-0-NCHW-FP32-F=ConvDirectNaiveConvFwd:127.067,0,miopenConvolutionFwdAlgoDirect;GemmFwdRest:6.44664,300810240,miopenConvolutionFwdAlgoGEMM
64-272-480-4x4-24-544-960-1-1x1-2x2-1x1-0-NCHW-FP32-B=ConvDirectNaiveConvBwd:650.311,0,miopenConvolutionBwdDataAlgoDirect;GemmBwdRest:3.87625,200540160,miopenConvolutionBwdDataAlgoGEMM
7-68-120-3x3-96-34-60-1-1x1-2x2-1x1-0-NCHW-FP32-F=ConvDirectNaiveConvFwd:0.380486,0,miopenConvolutionFwdAlgoDirect;GemmFwdRest:0.06702,514080,miopenConvolutionFwdAlgoGEMM
96-34-60-3x3-192-17-30-1-1x1-2x2-1x1-0-NCHW-FP32-F=ConvDirectNaiveConvFwd:1.48201,0,miopenConvolutionFwdAlgoDirect;GemmFwdRest:0.199503,1762560,miopenConvolutionFwdAlgoGEMM
192-17-30-3x3-192-17-30-1-1x1-1x1-1x1-0-NCHW-FP32-F=ConvDirectNaiveConvFwd:2.74881,0,miopenConvolutionFwdAlgoDirect;GemmFwdRest:0.394694,3525120,miopenConvolutionFwdAlgoGEMM
192-17-30-4x4-24-34-60-1-1x1-2x2-1x1-0-NCHW-FP32-B=ConvDirectNaiveConvBwd:9.10755,0,miopenConvolutionBwdDataAlgoDirect;GemmBwdRest:0.144553,783360,miopenConvolutionBwdDataAlgoGEMM
12-136-240-3x3-64-68-120-1-1x1-2x2-1x1-0-NCHW-FP32-F=ConvDirectNaiveConvFwd:1.67413,0,miopenConvolutionFwdAlgoDirect;GemmFwdRest:0.16677,3525120,miopenConvolutionFwdAlgoGEMM
64-68-120-3x3-128-34-60-1-1x1-2x2-1x1-0-NCHW-FP32-F=ConvDirectNaiveConvFwd:2.80777,0,miopenConvolutionFwdAlgoDirect;GemmFwdRest:0.296177,4700160,miopenConvolutionFwdAlgoGEMM
128-34-60-3x3-128-34-60-1-1x1-1x1-1x1-0-NCHW-FP32-F=ConvDirectNaiveConvFwd:5.872,0,miopenConvolutionFwdAlgoDirect;GemmFwdRest:0.434543,9400320,miopenConvolutionFwdAlgoGEMM
128-34-60-4x4-24-68-120-1-1x1-2x2-1x1-0-NCHW-FP32-B=ConvDirectNaiveConvBwd:25.3323,0,miopenConvolutionBwdDataAlgoDirect;GemmBwdRest:0.241403,3133440,miopenConvolutionBwdDataAlgoGEMM
12-272-480-3x3-48-136-240-1-1x1-2x2-1x1-0-NCHW-FP32-F=ConvDirectNaiveConvFwd:4.11706,0,miopenConvolutionFwdAlgoDirect;GemmFwdRest:0.513026,14100480,miopenConvolutionFwdAlgoGEMM
48-136-240-3x3-96-68-120-1-1x1-2x2-1x1-0-NCHW-FP32-F=ConvDirectNaiveConvFwd:8.77102,0,miopenConvolutionFwdAlgoDirect;GemmFwdRest:0.532764,14100480,miopenConvolutionFwdAlgoGEMM
96-68-120-3x3-96-68-120-1-1x1-1x1-1x1-0-NCHW-FP32-F=ConvDirectNaiveConvFwd:16.4064,0,miopenConvolutionFwdAlgoDirect;GemmFwdRest:0.7041,28200960,miopenConvolutionFwdAlgoGEMM
96-68-120-4x4-24-136-240-1-1x1-2x2-1x1-0-NCHW-FP32-B=ConvDirectNaiveConvBwd:57.275,0,miopenConvolutionBwdDataAlgoDirect;GemmBwdRest:0.36778,12533760,miopenConvolutionBwdDataAlgoGEMM
12-544-960-3x3-32-272-480-1-1x1-2x2-1x1-0-NCHW-FP32-F=ConvDirectNaiveConvFwd:18.5335,0,miopenConvolutionFwdAlgoDirect;GemmFwdRest:0.857932,56401920,miopenConvolutionFwdAlgoGEMM
32-272-480-3x3-64-136-240-1-1x1-2x2-1x1-0-NCHW-FP32-F=ConvDirectNaiveConvFwd:19.0818,0,miopenConvolutionFwdAlgoDirect;GemmFwdRest:0.93724,37601280,miopenConvolutionFwdAlgoGEMM
64-136-240-3x3-64-136-240-1-1x1-1x1-1x1-0-NCHW-FP32-F=ConvDirectNaiveConvFwd:33.8991,0,miopenConvolutionFwdAlgoDirect;GemmFwdRest:2.01289,75202560,miopenConvolutionFwdAlgoGEMM
64-136-240-4x4-24-272-480-1-1x1-2x2-1x1-0-NCHW-FP32-B=ConvDirectNaiveConvBwd:143.625,0,miopenConvolutionBwdDataAlgoDirect;GemmBwdRest:0.595892,50135040,miopenConvolutionBwdDataAlgoGEMM
